{
  "schemaVersion": 1,
  "id": "pos.exchange-cash-order",
  "name": "Exchange a cash order",
  "description": "Exchange exact eligible lines in an approved cash-only Shopify POS test order for exact replacement variants, with per-line return options, a customer choice, and Shopify read-back of the collect, even or refund result.",
  "domain": "shopify-pos",
  "scenario": "pos.exchange-cash-order",
  "scenarioVersion": 2,
  "parameters": {},
  "assertionMode": "pos-shopify-oms",
  "tags": [
    "mutation",
    "exchange",
    "cash",
    "test-store"
  ]
}
